{
  "schema_version": 1,
  "agent": {
    "agent_id": "a1000000-0000-4000-8000-000000000001",
    "workspace_id": "11111111-1111-4111-8111-111111111111",
    "name": "合成知识服务 Agent",
    "description": "只使用合成知识和只读工具的阶段三契约样本。",
    "status": "active",
    "created_by_actor_id": "22222222-2222-4222-8222-222222222222",
    "created_at": "2026-08-16T00:00:00Z",
    "updated_at": "2026-08-16T00:10:00Z",
    "version": 3
  },
  "agent_draft": {
    "draft_id": "a2000000-0000-4000-8000-000000000001",
    "agent_id": "a1000000-0000-4000-8000-000000000001",
    "workspace_id": "11111111-1111-4111-8111-111111111111",
    "revision": 3,
    "status": "approved",
    "configuration": {
      "prompt_version_id": "a3000000-0000-4000-8000-000000000001",
      "runtime_config_version_id": "a4000000-0000-4000-8000-000000000001",
      "knowledge_scope_version_ids": ["a5000000-0000-4000-8000-000000000001"],
      "workflow_release_id": "a6000000-0000-4000-8000-000000000001",
      "read_only_tools": [
        {
          "tool_id": "a7000000-0000-4000-8000-000000000001",
          "tool_version": 2,
          "access_mode": "read",
          "permission_code": "knowledge.document.read"
        }
      ],
      "output_schema_version_id": "a8000000-0000-4000-8000-000000000001",
      "safety_policy_version_id": "a9000000-0000-4000-8000-000000000001",
      "limits": {
        "max_input_tokens": 8192,
        "max_output_tokens": 2048,
        "max_execution_seconds": 120,
        "max_cost_microunits": 500000
      }
    },
    "config_hash": "1111111111111111111111111111111111111111111111111111111111111111",
    "updated_by_actor_id": "22222222-2222-4222-8222-222222222222",
    "updated_at": "2026-08-16T00:10:00Z"
  },
  "release_candidate": {
    "candidate_id": "aa000000-0000-4000-8000-000000000001",
    "agent_id": "a1000000-0000-4000-8000-000000000001",
    "draft_id": "a2000000-0000-4000-8000-000000000001",
    "workspace_id": "11111111-1111-4111-8111-111111111111",
    "draft_revision": 3,
    "candidate_hash": "2222222222222222222222222222222222222222222222222222222222222222",
    "config_hash": "1111111111111111111111111111111111111111111111111111111111111111",
    "status": "approved",
    "evaluation": {
      "evaluation_run_id": "ab000000-0000-4000-8000-000000000001",
      "dataset_version": "p301-agent-control-v1",
      "evaluation_policy_version_id": "ac000000-0000-4000-8000-000000000001",
      "status": "passed",
      "required_checks": [
        { "check_code": "functional", "status": "passed", "evidence_hash": "3333333333333333333333333333333333333333333333333333333333333333" },
        { "check_code": "authorization", "status": "passed", "evidence_hash": "4444444444444444444444444444444444444444444444444444444444444444" },
        { "check_code": "prompt_injection", "status": "passed", "evidence_hash": "5555555555555555555555555555555555555555555555555555555555555555" },
        { "check_code": "citation", "status": "passed", "evidence_hash": "6666666666666666666666666666666666666666666666666666666666666666" },
        { "check_code": "output_contract", "status": "passed", "evidence_hash": "7777777777777777777777777777777777777777777777777777777777777777" }
      ],
      "completed_at": "2026-08-16T00:20:00Z"
    },
    "approval": {
      "approval_instance_id": "ad000000-0000-4000-8000-000000000001",
      "approval_policy_version_id": "ae000000-0000-4000-8000-000000000001",
      "candidate_hash": "2222222222222222222222222222222222222222222222222222222222222222",
      "status": "approved",
      "approved_at": "2026-08-16T00:30:00Z"
    },
    "created_at": "2026-08-16T00:15:00Z"
  },
  "agent_release": {
    "release_id": "af000000-0000-4000-8000-000000000001",
    "agent_id": "a1000000-0000-4000-8000-000000000001",
    "workspace_id": "11111111-1111-4111-8111-111111111111",
    "release_version": 1,
    "status": "released",
    "candidate_hash": "2222222222222222222222222222222222222222222222222222222222222222",
    "config_hash": "1111111111111111111111111111111111111111111111111111111111111111",
    "snapshot_hash": "8888888888888888888888888888888888888888888888888888888888888888",
    "snapshot": {
      "snapshot_schema_version": 1,
      "source_draft_id": "a2000000-0000-4000-8000-000000000001",
      "source_draft_revision": 3,
      "configuration": {
        "prompt_version_id": "a3000000-0000-4000-8000-000000000001",
        "runtime_config_version_id": "a4000000-0000-4000-8000-000000000001",
        "knowledge_scope_version_ids": ["a5000000-0000-4000-8000-000000000001"],
        "workflow_release_id": "a6000000-0000-4000-8000-000000000001",
        "read_only_tools": [
          {
            "tool_id": "a7000000-0000-4000-8000-000000000001",
            "tool_version": 2,
            "access_mode": "read",
            "permission_code": "knowledge.document.read"
          }
        ],
        "output_schema_version_id": "a8000000-0000-4000-8000-000000000001",
        "safety_policy_version_id": "a9000000-0000-4000-8000-000000000001",
        "limits": {
          "max_input_tokens": 8192,
          "max_output_tokens": 2048,
          "max_execution_seconds": 120,
          "max_cost_microunits": 500000
        }
      },
      "evaluation": {
        "evaluation_run_id": "ab000000-0000-4000-8000-000000000001",
        "dataset_version": "p301-agent-control-v1",
        "evaluation_policy_version_id": "ac000000-0000-4000-8000-000000000001",
        "status": "passed",
        "required_checks": [
          { "check_code": "functional", "status": "passed", "evidence_hash": "3333333333333333333333333333333333333333333333333333333333333333" },
          { "check_code": "authorization", "status": "passed", "evidence_hash": "4444444444444444444444444444444444444444444444444444444444444444" },
          { "check_code": "prompt_injection", "status": "passed", "evidence_hash": "5555555555555555555555555555555555555555555555555555555555555555" },
          { "check_code": "citation", "status": "passed", "evidence_hash": "6666666666666666666666666666666666666666666666666666666666666666" },
          { "check_code": "output_contract", "status": "passed", "evidence_hash": "7777777777777777777777777777777777777777777777777777777777777777" }
        ],
        "completed_at": "2026-08-16T00:20:00Z"
      },
      "approval": {
        "approval_instance_id": "ad000000-0000-4000-8000-000000000001",
        "approval_policy_version_id": "ae000000-0000-4000-8000-000000000001",
        "candidate_hash": "2222222222222222222222222222222222222222222222222222222222222222",
        "status": "approved",
        "approved_at": "2026-08-16T00:30:00Z"
      }
    },
    "released_by_actor_id": "22222222-2222-4222-8222-222222222222",
    "released_at": "2026-08-16T00:31:00Z"
  },
  "service": {
    "service_id": "b1000000-0000-4000-8000-000000000001",
    "workspace_id": "11111111-1111-4111-8111-111111111111",
    "name": "合成知识服务",
    "service_type": "custom_knowledge_agent",
    "status": "active",
    "access_policy_version_id": "b2000000-0000-4000-8000-000000000001",
    "version": 2
  },
  "service_route": {
    "route_id": "b3000000-0000-4000-8000-000000000001",
    "service_id": "b1000000-0000-4000-8000-000000000001",
    "workspace_id": "11111111-1111-4111-8111-111111111111",
    "route_version": 2,
    "route_mode": "canary",
    "primary_release_id": "af000000-0000-4000-8000-000000000002",
    "canary_release_id": "af000000-0000-4000-8000-000000000001",
    "canary_percent": 10,
    "previous_route_id": "b3000000-0000-4000-8000-000000000002",
    "route_hash": "9999999999999999999999999999999999999999999999999999999999999999",
    "created_by_actor_id": "22222222-2222-4222-8222-222222222222",
    "created_at": "2026-08-16T00:40:00Z"
  },
  "run_binding": {
    "run_id": "b4000000-0000-4000-8000-000000000001",
    "workspace_id": "11111111-1111-4111-8111-111111111111",
    "service_id": "b1000000-0000-4000-8000-000000000001",
    "service_route_id": "b3000000-0000-4000-8000-000000000001",
    "service_route_version": 2,
    "agent_release_id": "af000000-0000-4000-8000-000000000001",
    "bound_at": "2026-08-16T00:41:00Z"
  }
}
